{
 "schema": 1,
 "id": "ptasan",
 "type": "term",
 "names": {
  "name": "ptasan",
  "local": "ptasan",
  "local_lang": "Squliq Atayal",
  "said": "ptasan"
 },
 "etymology": {
  "root": "Related to the Atayal word for writing and marking — the face as a written surface.",
  "tier": "cited",
  "source": "s:wp-atayal-people"
 },
 "region": [
  "east-asia"
 ],
 "facets": {
  "means": "write"
 },
 "text": {
  "what": "Related to the Atayal word for writing and marking — the face as a written surface."
 },
 "text_th": {
  "what": "เกี่ยวข้องกับคำว่าเขียนหรือทำเครื่องหมาย ใบหน้าคือพื้นผิวที่เขียนลงไป"
 },
 "sources": [
  "s:wp-atayal-people"
 ],
 "provenance": {
  "default": {
   "tier": "cited",
   "source": "s:wp-atayal-people"
  },
  "fields": {
   "text_th": {
    "tier": "inference",
    "note": "written in Thai by this project, not machine-translated"
   }
  }
 },
 "confidence": "medium",
 "tags": [],
 "updated": "2026-09-19"
}
